<?xml version="1.0" encoding="UTF-8"?>
<settings xmlns:xsi="http://www.w3.org/2001/XMLSchema-instance"
          xsi:noNamespaceSchemaLocation="settings.xsd">

    <!-- target: base folder of generated files (relative to the project root) -->

    <!-- sql: base folder of SQL files (relative to the project root) -->

    <folders target="dbal" sql="sdm/sql"/>

    <dto scope="" inheritance="" field-names-mode="0" macro=""/>

    <dao scope="" field-assign-mode="0" macro=""/>

    <ide event-log="true"/>

    <jdbc jar="lib/sqlite-jdbc-3.42.0.0.jar" class="org.sqlite.JDBC"
          url="jdbc:sqlite:$PROJECT_DIR$/todolist.sqlite" user="" pwd=""/>

    <!--    <jdbc jar="mysql-connector-j-26.7.0.jar" class="com.mysql.cj.jdbc.Driver"-->
    <!--          url="jdbc:mysql://localhost/todolist" user="root" pwd="sa"/>-->

    <!--    <jdbc jar="postgresql-42.3.4.jar" class="org.postgresql.Driver"-->
    <!--          url="jdbc:postgresql://localhost:5432/todolist" user="postgres" pwd="sa" />-->

    <type-map default="">

        <type detected="java.lang.Short" target="int"/>
        <type detected="java.lang.Integer" target="int"/>
        <type detected="java.lang.Long" target="long"/>

        <type detected="java.lang.Double" target="float"/>
        <type detected="java.lang.Float" target="float"/>
        <type detected="java.math.BigDecimal" target="float"/>

        <type detected="java.util.Date" target="datetime.datetime"/>
        <type detected="java.time.ZonedDateTime" target="datetime.datetime"/>
        <type detected="java.time.LocalDateTime" target="datetime.datetime"/>

        <type detected="java.lang.String" target="str"/>
        <type detected="java.lang.Boolean" target="bool"/>
        <type detected="byte[]" target="bytes"/>

        <type detected="java.lang.Object" target="object"/>

    </type-map>

    <macros>
    </macros>

</settings>