<?xml version="1.0" encoding="UTF-8"?>
<settings xmlns:xsi="http://www.w3.org/2001/XMLSchema-instance"
		  xsi:noNamespaceSchemaLocation="settings.xsd">

	<!-- target: base folder of generated files (relative to the project root). -->

	<!-- sql: base folder of SQL files (relative to the project root) -->

	<folders target="api" sql="sdm/sql"/>

	<!-- scope: the name of DTO namespace. An empty one is OK. -->

	<!-- field-names-mode: 0 - TitleCase, 1 - camelCase; 2 - snake_case -->

	<dto scope="svc/dto" inheritance="" field-names-mode="2" macro=""/>

	<!-- scope: the name of DTO namespace. An empty one is OK. -->

	<dao scope="svc/dao" field-assign-mode="0" macro=""/>

	<ide event-log="true"/>

	<jdbc jar="lib/sqlite-jdbc-3.42.0.0.jar" class="org.sqlite.JDBC"
		  url="jdbc:sqlite:$PROJECT_DIR$/todolist.sqlite" user="" pwd=""/>

	<!--    <jdbc jar="mysql-connector-j-26.7.0.jar" class="com.mysql.cj.jdbc.Driver"-->
	<!--          url="jdbc:mysql://localhost/todolist" user="root" pwd="sa"/>-->

	<!--    <jdbc jar="postgresql-42.3.4.jar" class="org.postgresql.Driver"-->
	<!--          url="jdbc:postgresql://localhost:5432/todolist" user="postgres" pwd="sa" />-->

	<!--    <jdbc jar="ojdbc10.jar" class="oracle.jdbc.driver.OracleDriver"-->
	<!--          url="jdbc:oracle:thin:@localhost:1521/XE" user="todolist" pwd="sa"/>-->

	<!--    <jdbc jar="mssql-jdbc-8.2.2.jre8.jar" class="com.microsoft.sqlserver.jdbc.SQLServerDriver"-->
	<!--          url="jdbc:sqlserver://localhost:1433;instance=SQLEXPRESS;databaseName=AdventureWorks2014" user="sa" pwd="root"/>-->

	<type-map default="">

		<type detected="java.lang.Short" target="int"/>
		<type detected="java.lang.Integer" target="int"/>
		<type detected="java.lang.Long" target="int"/>

		<type detected="java.lang.Float" target="float"/>
		<type detected="java.lang.Double" target="float"/>
		<type detected="java.math.BigDecimal" target="float"/>

		<type detected="java.util.Date" target="string"/>
		<type detected="java.lang.String" target="string"/>
		<type detected="java.lang.Boolean" target="bool"/>
		<type detected="byte[]" target="array"/>
		<type detected="java.lang.Object" target="object"/>

	</type-map>

	<macros>
	</macros>

</settings>