<?xml version="1.0" encoding="UTF-8"?>
<settings xmlns:xsi="http://www.w3.org/2001/XMLSchema-instance"
          xsi:noNamespaceSchemaLocation="settings.xsd">

    <!-- target: base folder of generated files (relative to the project root). -->

    <!-- sql: base folder of SQL files (relative to the project root) -->

    <folders target="api" sql="sdm/sql"/>

    <!-- scope: the name of DTO namespace. An empty one is OK. -->

    <!-- field-names-mode: 0 - TitleCase, 1 - camelCase; 2 - snake_case -->

    <dto scope="svc/models" inheritance="" field-names-mode="2" macro=""/>

    <!-- scope: the name of DTO namespace. An empty one is OK. -->

    <dao scope="svc/dao" field-assign-mode="0" macro=""/>

    <ide event-log="true"/>

    <jdbc jar="lib/sqlite-jdbc-3.42.0.0.jar" class="org.sqlite.JDBC"
          url="jdbc:sqlite:$PROJECT_DIR$/todolist.sqlite" user="" pwd=""/>

    <!--    <jdbc jar="mysql-connector-j-26.7.0.jar" class="com.mysql.cj.jdbc.Driver"-->
    <!--          url="jdbc:mysql://localhost/todolist" user="root" pwd="sa"/>-->

    <!--    <jdbc jar="postgresql-42.3.4.jar" class="org.postgresql.Driver"-->
    <!--          url="jdbc:postgresql://localhost:5432/todolist" user="postgres" pwd="sa" />-->

    <!--    <jdbc jar="ojdbc10.jar" class="oracle.jdbc.driver.OracleDriver"-->
    <!--          url="jdbc:oracle:thin:@localhost:1521/XE" user="todolist" pwd="sa"/>-->

    <type-map default="">

        <!-- ******   PHP Doctrine   ****** -->

        <!-- https://www.doctrine-project.org/projects/doctrine-dbal/en/latest/reference/types.html-->

        <type detected="doctrine-java.lang.Short" target="${doctrine-type}|0:smallint|1:int"/>
        <type detected="doctrine-java.lang.Integer" target="${doctrine-type}|0:integer|1:int"/>
        <type detected="doctrine-java.lang.Long" target="${doctrine-type}|0:bigint|1:string"/>

        <type detected="doctrine-java.lang.Float" target="${doctrine-type}|0:float|1:float"/>
        <type detected="doctrine-java.lang.Double" target="${doctrine-type}|0:float|1:float"/>
        <type detected="doctrine-java.math.BigDecimal" target="${doctrine-type}|0:decimal|1:string"/>

        <type detected="doctrine-java.util.Date" target="${doctrine-type}|0:datetime|1:\DateTime"/>
        <type detected="doctrine-java.lang.String" target="${doctrine-type}|0:string|1:string"/>
        <type detected="doctrine-java.lang.Boolean" target="${doctrine-type}|0:boolean|1:bool"/>
        <type detected="doctrine-byte[]" target="${doctrine-type}|0:array|1:array"/>
        <type detected="doctrine-java.lang.Object" target="${doctrine-type}|0:object|1:object"/>

        <!-- ******   PHP scalar types  ****** -->

        <type detected="java.lang.Short" target="int"/>
        <type detected="java.lang.Integer" target="int"/>
        <type detected="java.lang.Long" target="int"/>

        <type detected="java.lang.Float" target="float"/>
        <type detected="java.lang.Double" target="float"/>
        <type detected="java.math.BigDecimal" target="float"/>

        <type detected="java.util.Date" target="string"/>
        <type detected="java.lang.String" target="string"/>
        <type detected="java.lang.Boolean" target="bool"/>
        <type detected="byte[]" target="array"/>
        <type detected="java.lang.Object" target="object"/>

    </type-map>

    <macros>

        <!-- =built-in= is a key-word -->

        <macro name="${column}" value="=built-in="/>
        <macro name="${lower_snake_case(column)}" value="=built-in="/>
        <macro name="${camelCase(column)}" value="=built-in="/>
        <macro name="${TitleCase(column)}" value="=built-in="/>
        <macro name="${kebab-case(column)}" value="=built-in="/>

        <!-- PHP Doctrine ORM field type: -->

        <!-- https://www.doctrine-project.org/projects/doctrine-orm/en/2.11/reference/attributes-reference.html#attrref_column-->

        <macro name="${doctrine-type}">
            <vm-xml>
                <print var="@ORM\Column(name=&quot;${column}&quot;, type=&quot;${0}&quot;"/>
                <if var="$fi.ColumnSize>0">
                    <print var=", length=$fi.ColumnSize"/>
                </if>
                <if var="!$fi.PK">
                    <if var="$fi.Unique">
                        <print var=", unique=true"/>
                    </if>
                    <if var="$fi.Nullable">
                        <print var=", nullable=true"/>
                    </if>
                </if>
                <print var=")"/>
                <if var="$fi.PK">
                    <br/>
                    <br/>
                    <print var="     * @ORM\Id"/>
                </if>
                <if var="$fi.AI">
                    <br/>
                    <br/>
                    <print var="     * @ORM\GeneratedValue"/>
                </if>
                <br/>
                <br/>
                <print var="     * @var ${1}"/>
            </vm-xml>
        </macro>

    </macros>

</settings>